{
 "subject": "principles formalised from takhrīj gaps, with their sources and rationale",
 "status": "candidate",
 "provenance": "Each statement and excerpt verified verbatim against the pinned witness (letters-only comparison) and each OpenITI locator computed from the closing page marker. Rationale is the formaliser's reading and awaits human review (Review.tla); none of these entries adopts a ruling.",
 "entries": [
  {
   "id": "ahd_blocks_generality",
   "title": "ʿAhd blocks the generality of al-",
   "terms": [
    "amm",
    "ahd",
    "khass"
   ],
   "statement": {
    "ref": "ibn_lahham.qawaid_fawaid.openiti_lahham_shamela8526.q052",
    "note": "Ibn al-Laḥḥām, qāʿida 52: the singular with al- is general «إذا لم تكن هناك قرينة عهد», when there is no indication of a known referent."
   },
   "refs": [
    {
     "ref": "ibn_lahham.qawaid_fawaid.openiti_lahham_shamela8526.q053.f006",
     "note": "«أوصيت لجاري محمد» with two neighbours of that name: the proper name pins the referent, «مخالف للقاعدة»."
    },
    {
     "ref": "ibn_lahham.qawaid_fawaid.openiti_lahham_shamela8526.q052.f003",
     "note": "«تنزهوا من البول»: the companions read al- as ʿahd (human urine) «بقرينة»."
    }
   ],
   "conditions": [
    "a marker of generality (al- of genus, an annexed singular, a particle, or an indefinite in negation, prohibition or condition)",
    "no indication of ʿahd and no proper name pinning the referent"
   ],
   "rationale": "The generality of al- is the default reading of the marker, and the qāʿida states its own blocking condition. Five of the six generality ikhtilāf cases split exactly on whether al- is ʿahd or genus, so the blocking fact must be an input: without it the kernel always took genus and landed on the minority side.",
   "lean": [
    "Usul.Dalala.IsGeneralIn",
    "Usul.Dalala.isGeneralIn_no_ahd",
    "Usul.Dalala.ahd_blocks",
    "Usul.Dalala.isGeneralIn_is_gate"
   ],
   "conservative": "Usul.Dalala.isGeneralIn_no_ahd",
   "closes": [
    "fact:ahd"
   ],
   "iq": []
  },
  {
   "id": "confused_entitlement_lots",
   "title": "A specific entitlement lost in confusion goes to lots",
   "terms": [
    "qurah"
   ],
   "statement": {
    "ref": "ibn_rajab.taqrir_qawaid.openiti_rajab_shamela21730.q160",
    "note": "Ibn Rajab, qāʿida 160: lots distinguish the entitled when entitlement attaches to an unspecified one among equals, and «ويستعمل أيضا في تمييز المستحق المعين في نفس الأمر عن اشتباهه»."
   },
   "refs": [
    {
     "ref": "src:openiti-rajab-shamela21730/v01:p348",
     "excerpt_ar": "ويستعمل أيضا في تمييز المستحق المعين في نفس الأمر عن اشتباهه",
     "note": "The second category, verbatim."
    },
    {
     "ref": "ibn_rajab.taqrir_qawaid.openiti_rajab_shamela21730.q160.f007",
     "note": "A deposit claimed by two, the depositary not knowing whose: lot (naṣṣ of Aḥmad)."
    }
   ],
   "conditions": [
    "the entitled person is specific in fact (muʿayyan fī nafs al-amr)",
    "he is confused with others and cannot be identified"
   ],
   "rationale": "Al-Saʿdī's Q25 orders known entitled, then division, then lots. That fits Ibn Rajab's first category but not his second, where a specific entitled person lost in confusion is recovered by lot although the thing could be divided. Division would give a share to someone certainly not entitled.",
   "lean": [
    "Usul.Refinements.allocationFull",
    "Usul.Refinements.allocationFull_conservative",
    "Usul.Refinements.confused_goes_to_lot"
   ],
   "conservative": "Usul.Refinements.allocationFull_conservative",
   "closes": [
    "fact:confusion_category"
   ],
   "iq": [
    "IQ-09"
   ]
  },
  {
   "id": "recourse_two_types",
   "title": "Recourse: paying another's due, or spending by permission",
   "terms": [
    "daman"
   ],
   "statement": {
    "ref": "ibn_rajab.taqrir_qawaid.openiti_rajab_shamela21730.q075",
    "note": "Ibn Rajab, qāʿida 75: recourse for what one spends on another's property without his permission is of two types: «من أدى واجبا عن غيره» and «من أنفق على ما تعلق به حقه من مال غيره»."
   },
   "refs": [
    {
     "ref": "src:openiti-rajab-shamela21730/v01:p138",
     "excerpt_ar": "لأن إذنه قائم مقام إذن الغائب",
     "note": "The judge's permission gives recourse for spending on a found item, «because his permission stands in place of the absent owner's»."
    },
    {
     "ref": "ibn_rajab.taqrir_qawaid.openiti_rajab_shamela21730.q075.f010",
     "note": "A lessee rebuilding the rented house has no recourse (naṣṣ): the rebuilding was not owed by the lessor."
    }
   ],
   "conditions": [
    "not given as a gift (al-Qāḍī: the payer intends recourse)",
    "either the payment discharged an obligation owed by the other party, or the spending was by the owner's or the judge's permission"
   ],
   "rationale": "Al-Saʿdī's Q32 covers the first type only. The furūʿ under qāʿida 75 turn on whether the expense was owed by the other party and on permission, so both become inputs. With owed-by-other true the reading is Q32's.",
   "lean": [
    "Usul.Refinements.recourseFull",
    "Usul.Refinements.recourseFull_conservative",
    "Usul.Refinements.no_recourse_unowed_unpermitted"
   ],
   "conservative": "Usul.Refinements.recourseFull_conservative",
   "closes": [
    "fact:owed_by_other",
    "fact:permission"
   ],
   "iq": [
    "IQ-07"
   ]
  },
  {
   "id": "recourse_necessity",
   "title": "Recourse when the owner's permission cannot be sought",
   "terms": [
    "daman"
   ],
   "statement": {
    "ref": "ibn_rajab.taqrir_qawaid.openiti_rajab_shamela21730.q075.f006",
    "note": "«الحيوان المودع إذا أنفق عليه المستودع ناويا للرجوع فإن تعذر استئذان مالكه رجع»."
   },
   "refs": [
    {
     "ref": "src:openiti-rajab-shamela21730/v01:p138",
     "excerpt_ar": "لأن إذنه قائم مقام إذن الغائب",
     "note": "The same ground: what stands in for the absent owner's permission."
    }
   ],
   "conditions": [
    "intending recourse",
    "asking the owner was impossible"
   ],
   "rationale": "Where permission could not be sought, the text gives recourse outright, and keeps the two ṭarīqas only for the case where asking was possible. Necessity stands where permission would have.",
   "lean": [
    "Usul.Refinements.recourseNec",
    "Usul.Refinements.recourseNec_conservative"
   ],
   "conservative": "Usul.Refinements.recourseNec_conservative",
   "closes": [
    "fact:permission_unobtainable"
   ],
   "iq": [
    "IQ-07"
   ]
  },
  {
   "id": "amara_on_equal_grades",
   "title": "On equal grades the ẓāhir needs indicators",
   "terms": [
    "asl",
    "zahir",
    "zann",
    "amara",
    "yaqin"
   ],
   "statement": {
    "ref": "src:openiti-rajab-shamela21730/v01:p341",
    "excerpt_ar": "لأن الوقت عليه أمارات تعرف بها فاكتفي فيها بالظن الغالب، بخلاف ما لا أمارة عليه من إتمام الصلاة والطهارة",
    "note": "Ibn Rajab on breaking the fast at believed sunset (qāʿida 159): time has indicators, so preponderant belief suffices, unlike what has none: completing prayer, purity, ḥadath."
   },
   "refs": [
    {
     "ref": "ibn_rajab.taqrir_qawaid.openiti_rajab_shamela21730.q159",
     "note": "Qāʿida 159: when aṣl and ẓāhir conflict, a ẓāhir that is a sharʿī proof prevails; one resting on custom or indications sometimes yields, sometimes prevails, and is sometimes disputed."
    },
    {
     "ref": "ibn_rajab.taqrir_qawaid.openiti_rajab_shamela21730.q159.f008",
     "note": "Doubting dawn: «ولا عبرة في ذلك بغلبة الظن وبالقرائن» unless a reliable report."
    }
   ],
   "conditions": [
    "a ẓāhir strictly stronger than the aṣl always prevails (a sharʿī proof)",
    "on equal grades the ẓāhir prevails only where the matter has indicators by which it is known"
   ],
   "rationale": "Equal grades produced opposite rulings in the cases (purity and dawn keep the aṣl; sunset follows the ẓāhir), so the grade cannot be the deciding input. Ibn Rajab names the deciding fact himself: whether the matter has indicators.",
   "lean": [
    "Usul.Refinements.zahirPrevails",
    "Usul.Refinements.zahirPrevails_conservative",
    "Usul.Refinements.tie_without_amara_keeps_asl",
    "Usul.Refinements.stronger_prevails"
   ],
   "conservative": "Usul.Refinements.zahirPrevails_conservative",
   "closes": [
    "fact:amara"
   ],
   "iq": [
    "IQ-20"
   ]
  },
  {
   "id": "unknown_as_nonexistent",
   "title": "The unknown is treated as non-existent",
   "terms": [
    "majhul",
    "asl",
    "yaqin"
   ],
   "statement": {
    "ref": "ibn_rajab.taqrir_qawaid.openiti_rajab_shamela21730.q106",
    "note": "Ibn Rajab, qāʿida 106: «ينزل المجهول منزلة المعدوم وإن كان الأصل بقاءه إذا يئس من الوقوف عليه أو شق اعتباره»."
   },
   "refs": [
    {
     "ref": "ibn_rajab.taqrir_qawaid.openiti_rajab_shamela21730.q106.f004",
     "note": "The exception: if the forbidden is many and predominant, the case falls to the conflict of aṣl and ẓāhir."
    },
    {
     "ref": "ibn_rajab.taqrir_qawaid.openiti_rajab_shamela21730.q106.f001",
     "note": "The mustaḥāḍa's excess days are set aside; the beginner's doubtful days are not, «لأن أمره ينكشف بالتكرار عن قرب»."
    }
   ],
   "conditions": [
    "the thing is unknown",
    "one despairs of learning it, or taking it into account is a hardship",
    "(exception) the forbidden is not many and predominant"
   ],
   "rationale": "Al-Saʿdī's Q20 states the right-holder case. Ibn Rajab's qāʿida is the general rule, and most of its furūʿ (istiḥāḍa, confused women, street mud) have no right-holder. Q20 is proved to be its instance (q20_is_instance).",
   "lean": [
    "Usul.Refinements.treatedAsAbsent",
    "Usul.Refinements.q20_is_instance",
    "Usul.Refinements.knowable_not_set_aside"
   ],
   "conservative": "Usul.Refinements.q20_is_instance",
   "closes": [
    "rule:unknown_as_nonexistent"
   ],
   "iq": []
  },
  {
   "id": "haml_ala_adna",
   "title": "An unspecified intention over ranked referents is read as the lowest",
   "terms": [
    "yaqin",
    "amm"
   ],
   "statement": {